<?xml version="1.0" encoding="utf-8"?>

<translates xmlns:xsi="http://www.w3.org/2001/XMLSchema-instance"
    xsi:noNamespaceSchemaLocation="../schemas/translates.xsd">

    <item id="#0257">
        <match type="equals">
            <text content="メモ機能" />
        </match>

        <translate>
            <en-US content="Memo Feature" />
            <zh-CN content="备忘录功能" />
            <zh-TW content="備忘功能" />
            <ko-KR content="Memo Feature" />
        </translate>
    </item>

    <item id="#0258">
        <match type="equals">
            <text content="モーフィング機能" />
        </match>

        <translate>
            <en-US content="Morphing Feature" />
            <zh-CN content="变声融合功能" />
            <zh-TW content="聲音混合功能" />
            <ko-KR content="Morphing Feature" />
        </translate>
    </item>

    <item id="#0259">
        <match type="equals">
            <text content="ルビ機能" />
        </match>

        <translate>
            <en-US content="Ruby Annotation Feature" />
            <zh-CN content="注音功能" />
            <zh-TW content="注音功能" />
            <ko-KR content="Ruby Annotation Feature" />
        </translate>
    </item>

    <item id="#0260">
        <match type="equals">
            <text content="一部のエンジンではこの機能を利用できません。" />
        </match>

        <translate>
            <en-US content="This feature is unavailable in some engines." />
            <zh-CN content="部分引擎不支持此功能。" />
            <zh-TW content="部分引擎不支持此功能。" />
            <ko-KR content="일부 엔진에서는 이 기능을 사용할 수 없습니다." />
        </translate>
    </item>

    <item id="#0261">
        <match type="equals">
            <text content="上書き防止" />
        </match>

        <translate>
            <en-US content="Prevent Overwriting" />
            <zh-CN content="防止覆盖" />
            <zh-TW content="防止覆寫" />
            <ko-KR content="Prevent Overwriting" />
        </translate>
    </item>

    <item id="#0262">
        <match type="equals">
            <text content="保存" />
        </match>

        <translate>
            <en-US content="Saving" />
            <zh-CN content="保存" />
            <zh-TW content="儲存" />
            <ko-KR content="Saving" />
        </translate>
    </item>

    <item id="#0263">
        <match type="equals">
            <text content="再生デバイス" />
        </match>

        <translate>
            <en-US content="Playback Device" />
            <zh-CN content="播放设备" />
            <zh-TW content="播放裝置" />
            <ko-KR content="Playback Device" />
        </translate>
    </item>

    <item id="#0264">
        <match type="equals">
            <text content="再生・保存時の音声のサンプリングレートを変更できます（サンプリングレートを上げても音声の品質は上がりません）。" />
        </match>

        <translate>
            <en-US content="You can change the audio sampling rate used for playback and saving (raising the sampling rate does not improve audio quality)." />
            <zh-CN content="可以更改播放和保存时的音频采样率（提高采样率不会提升音频质量）。" />
            <zh-TW content="可以變更播放及儲存時的音訊取樣率（提高取樣率不會提升音訊品質）。" />
            <ko-KR content="재생 및 저장 시 음성의 샘플링 레이트를 변경할 수 있습니다. (샘플링 레이트를 높여도 음성 품질은 향상되지 않습니다.)" />
        </translate>
    </item>

    <item id="#0265">
        <match type="equals">
            <text content="再生位置を追従" />
        </match>

        <translate>
            <en-US content="Follow Playback Position" />
            <zh-CN content="跟随播放位置" />
            <zh-TW content="跟隨播放位置" />
            <ko-KR content="Follow Playback Position" />
        </translate>
    </item>

    <item id="#0266">
        <match type="equals">
            <text content="再表示する" />
        </match>

        <translate>
            <en-US content="Show Again" />
            <zh-CN content="重新显示" />
            <zh-TW content="重新顯示" />
            <ko-KR content="다시 표시" />
        </translate>
    </item>

    <item id="#0267">
        <match type="equals">
            <text content="出力サンプリングレートを変更しても、音質は変化しません。また、音声の生成処理に若干時間がかかる場合があります。" />
        </match>

        <translate>
            <en-US content="Changing the output sampling rate does not change audio quality. Audio generation may also take slightly longer." />
            <zh-CN content="更改输出采样率不会改变音质。此外，音频生成处理可能需要稍长一些时间。" />
            <zh-TW content="變更輸出取樣率不會改變音質。此外，音訊產生處理可能需要稍長一些時間。" />
            <ko-KR content="출력 샘플링 레이트를 변경해도 음질은 변하지 않습니다. 또한 음성 생성에 약간의 시간이 더 걸릴 수 있습니다." />
        </translate>
    </item>

    <item id="#0268">
        <match type="equals">
            <text content="出力サンプリングレートを変更しますか？" />
        </match>

        <translate>
            <en-US content="Change the Output Sampling Rate?" />
            <zh-CN content="要更改输出采样率吗？" />
            <zh-TW content="要變更輸出取樣率嗎？" />
            <ko-KR content="출력 샘플링 레이트를 변경하시겠습니까?" />
        </translate>
    </item>

    <item id="#0269">
        <match type="equals">
            <text content="分割を行いません。" />
        </match>

        <translate>
            <en-US content="Do not split." />
            <zh-CN content="不拆分。" />
            <zh-TW content="不分割。" />
            <ko-KR content="Do 아님 split." />
        </translate>
    </item>

    <item id="#0270">
        <match type="equals">
            <text content="句点と改行" />
        </match>

        <translate>
            <en-US content="Periods and line breaks" />
            <zh-CN content="句号和换行" />
            <zh-TW content="句號與換行" />
            <ko-KR content="Periods 및 줄 breaks" />
        </translate>
    </item>

    <item id="#0271">
        <match type="equals">
            <text content="句点と改行を基にテキストを分割します。" />
        </match>

        <translate>
            <en-US content="Split text at periods and line breaks." />
            <zh-CN content="根据句号和换行拆分文本。" />
            <zh-TW content="依句號與換行分割文字。" />
            <ko-KR content="Split 텍스트 at periods 및 줄 breaks." />
        </translate>
    </item>

    <item id="#0272">
        <match type="equals">
            <text content="変更する" />
        </match>

        <translate>
            <en-US content="Change" />
            <zh-CN content="更改" />
            <zh-TW content="變更" />
            <ko-KR content="변경" />
        </translate>
    </item>

    <item id="#0273">
        <match type="equals">
            <text content="外観" />
        </match>

        <translate>
            <en-US content="Appearance" />
            <zh-CN content="外观" />
            <zh-TW content="外觀" />
            <ko-KR content="Appearance" />
        </translate>
    </item>

    <item id="#0274">
        <match type="equals">
            <text content="実験的機能" />
        </match>

        <translate>
            <en-US content="Experimental Features" />
            <zh-CN content="实验性功能" />
            <zh-TW content="實驗性功能" />
            <ko-KR content="Experimental 기능" />
        </translate>
    </item>

    <item id="#0275">
        <match type="equals">
            <text content="操作" />
        </match>

        <translate>
            <en-US content="Operation" />
            <zh-CN content="操作" />
            <zh-TW content="操作" />
            <ko-KR content="작업" />
        </translate>
    </item>

    <item id="#0276">
        <match type="equals">
            <text content="改行" />
        </match>

        <translate>
            <en-US content="Line breaks" />
            <zh-CN content="换行" />
            <zh-TW content="換行" />
            <ko-KR content="줄 breaks" />
        </translate>
    </item>

    <item id="#0277">
        <match type="equals">
            <text content="改行のみを基にテキストを分割します。" />
        </match>

        <translate>
            <en-US content="Split text at line breaks only." />
            <zh-CN content="仅根据换行拆分文本。" />
            <zh-TW content="僅依換行分割文字。" />
            <ko-KR content="줄바꿈만을 기준으로 텍스트를 나눕니다." />
        </translate>
    </item>

    <item id="#0278">
        <match type="equals">
            <text content="文字コード" />
        </match>

        <translate>
            <en-US content="Character Encoding" />
            <zh-CN content="字符编码" />
            <zh-TW content="字元編碼" />
            <ko-KR content="캐릭터 Encoding" />
        </translate>
    </item>

    <item id="#0279">
        <match type="equals">
            <text content="新しい表示言語を適用するため、今すぐ画面を再読み込みしますか？" />
        </match>

        <translate>
            <en-US content="Reload the screen now to apply the new display language?" />
            <zh-CN content="要立即重新加载页面以应用新的显示语言吗？" />
            <zh-TW content="要立即重新載入畫面以套用新的顯示語言嗎？" />
            <ko-KR content="새 표시 언어를 적용하기 위해 지금 화면을 다시 불러오시겠습니까?" />
        </translate>
    </item>

    <item id="#0280">
        <match type="equals">
            <text content="書き出し先のフォルダ" />
        </match>

        <translate>
            <en-US content="Export Destination Folder" />
            <zh-CN content="导出文件夹" />
            <zh-TW content="匯出資料夾" />
            <ko-KR content="내보내기 Destination 폴더" />
        </translate>
    </item>

    <item id="#0281">
        <match type="equals">
            <text content="書き出し先のフォルダを選択" />
        </match>

        <translate>
            <en-US content="Select export destination folder" />
            <zh-CN content="选择导出目标文件夹" />
            <zh-TW content="選擇匯出目標檔案夾" />
            <ko-KR content="선택 내보내기 destination 폴더" />
        </translate>
    </item>

    <item id="#0282">
        <match type="equals">
            <text content="書き出し先を固定" />
        </match>

        <translate>
            <en-US content="Fix Export Destination" />
            <zh-CN content="固定导出位置" />
            <zh-TW content="固定匯出位置" />
            <ko-KR content="Fix 내보내기 Destination" />
        </translate>
    </item>

    <item id="#0283">
        <match type="equals">
            <text content="書き出す際のファイル名のパターンをカスタマイズできます。" />
        </match>

        <translate>
            <en-US content="Customize the filename pattern used when exporting." />
            <zh-CN content="可以自定义导出时使用的文件名格式。" />